{
  "version": "0.1.0",
  "lastUpdate": "2026-06-18T00:00:00.000Z",
  "count": 2,
  "source": "https://observatorioia.org",
  "license": "CC BY 4.0",
  "data": [
    {
      "id": "foro-nacional-ia-salud-junio-2026",
      "fecha": "2026-06-17",
      "etiqueta": {
        "es": "Coyuntura · junio 2026",
        "en": "Current affairs · June 2026"
      },
      "titulo": {
        "es": "II Foro Nacional de IA en Salud: agenda nacional en construcción y 15 áreas piloto de la CCSS",
        "en": "Second National Forum on AI in Health: national agenda under construction and 15 CCSS pilot areas"
      },
      "texto": {
        "es": "El 17 de junio de 2026 se realizó el II Foro Nacional sobre Inteligencia Artificial en Salud, organizado por la Cámara Costarricense de la Salud (CCS), la Universidad Latinoamericana de Ciencia y Tecnología (ULACIT) y el Digital Health Institute for Transformation (DHIT) en el Auditorio Nacional del Museo de los Niños, San José. El programa incluyó el panel oficial 'La Agenda IA en Salud: retos, oportunidades y compromisos', con participación del Viceministro de Salud, Allan Mora, y del presidente del Colegio de Médicos y Cirujanos, Elliott Garita. En paralelo se desarrolló un Connectathon de Resultados de Laboratorio HL7 FHIR R5 como primer paso técnico hacia una guía nacional de interoperabilidad de datos clínicos. El director ejecutivo de la Cámara Costarricense de la Salud (CCS) / PROMED, Massimo Manzi, indicó que el país está cerca de oficializar una agenda nacional sobre IA en salud, elaborada en conjunto con el Ministerio de Salud y el Ministerio de Ciencia, Innovación, Tecnología y Telecomunicaciones (MICITT), y advirtió sobre el balance entre regulación y no frenar la innovación. Según Observador.cr, el gerente médico interino de la CCSS, Marvin Palma, declaró que la institución utiliza inteligencia artificial en 15 áreas piloto de atención primaria, incluyendo evaluación de riesgo cardiovascular y de pacientes diabéticos, y describió proyectos en análisis para identificar 'zonas calientes' en mamografías y otros estudios de imagen. La CCSS aclaró que la depuración de listas de espera con IA mantiene validación humana antes de retirar cualquier registro.",
        "en": "The Second National Forum on AI in Health took place on June 17, 2026, hosted by the Costa Rican Chamber of Health (CCS), the Latin American University of Science and Technology (ULACIT) and the Digital Health Institute for Transformation (DHIT) at the National Auditorium of the Children's Museum in San José. The program featured the official panel 'The AI in Health Agenda: challenges, opportunities and commitments', with participation of Deputy Minister of Health Allan Mora and Elliott Garita, president of the Costa Rican Medical Association. In parallel, an HL7 FHIR R5 Laboratory Results Connectathon was held as a first technical step toward a national clinical-data interoperability guide. Massimo Manzi, executive director of the Costa Rican Chamber of Health (CCS) / PROMED, said the country is close to officializing a national agenda on AI in health, drafted jointly with the Ministry of Health and the Ministry of Science, Innovation, Technology and Telecommunications (MICITT), and warned about balancing regulation and innovation. According to Observador.cr, acting CCSS medical manager Marvin Palma stated that the institution uses artificial intelligence in 15 primary-care pilot areas, including cardiovascular and diabetic risk assessment, and described projects under analysis to identify 'hot zones' in mammograms and other imaging studies. CCSS clarified that AI-assisted waiting-list cleanup keeps a human-validation step before removing any record."
      },
      "implicacion": {
        "es": "Costa Rica avanza hacia un marco específico para IA en salud antes que un marco general de IA: los tres expedientes legislativos de regulación de IA (23.771, 23.919 y 24.484) siguen sin convocatoria del Ejecutivo, mientras el sector salud impulsa una agenda propia con respaldo del Ejecutivo (Vice de Salud en panel oficial, coordinación Salud + MICITT), de la institucionalidad CCSS, de la academia (ULACIT) y de un cuerpo internacional (DHIT). El Connectathon HL7 FHIR R5 añade una dimensión técnica concreta: interoperabilidad de datos clínicos como precondición de cualquier despliegue masivo de IA. Esto consolida un patrón de regulación sectorial blanda en lugar de marco transversal; abre oportunidades de incidencia para actores del sector y aumenta la importancia de la trazabilidad institucional de los pilotos catalogados (AIDA, LIDIA, REDIMED, depuración de listas).",
        "en": "Costa Rica is moving toward a sector-specific framework for AI in health ahead of a general AI framework: the three AI regulation bills (23.771, 23.919 and 24.484) remain uncalled by the executive, while the health sector is pushing its own agenda with executive backing (Deputy Minister of Health on the official panel, Health + MICITT coordination), institutional support from CCSS, from academia (ULACIT) and from an international body (DHIT). The HL7 FHIR R5 Connectathon adds a concrete technical dimension: clinical-data interoperability as a precondition for any large-scale AI rollout. This consolidates a pattern of soft sectoral regulation rather than a cross-cutting framework; it opens advocacy opportunities for sector actors and increases the importance of institutional traceability of the catalogued pilots (AIDA, LIDIA, REDIMED, waiting-list cleanup)."
      },
      "fuentes": [
        {
          "url": "https://observador.cr/ccss-impulsa-uso-de-inteligencia-artificial-para-mamografias-listas-de-espera-y-atencion-medica/",
          "nombre": {
            "es": "Observador.cr",
            "en": "Observador.cr"
          },
          "descripcion": {
            "es": "Observador.cr — cobertura del II Foro Nacional sobre IA en Salud y declaraciones de Marvin Palma (CCSS) y Massimo Manzi (Cámara Costarricense de la Salud), 17 de junio de 2026.",
            "en": "Observador.cr — coverage of the Second National Forum on AI in Health and statements from Marvin Palma (CCSS) and Massimo Manzi (Costa Rican Chamber of Health), June 17, 2026."
          }
        },
        {
          "url": "https://delfino.cr/2026/06/ii-foro-sobre-inteligencia-artificial-en-salud-impulsara-la-implementacion-responsable-de-la-ia-en-costa-rica",
          "nombre": {
            "es": "Delfino.cr",
            "en": "Delfino.cr"
          },
          "descripcion": {
            "es": "Delfino.cr — convocatoria oficial del II Foro con organizadores (CCS + ULACIT + DHIT), agenda temática (ética y gobernanza, formación, retos prioritarios) y declaración de Massimo Manzi.",
            "en": "Delfino.cr — official announcement of the Second Forum with organizers (CCS + ULACIT + DHIT), thematic agenda (ethics and governance, training, priority challenges) and a statement from Massimo Manzi."
          }
        },
        {
          "url": "https://promedcostarica.glueup.com/event/ii-foro-sobre-inteligencia-artificial-en-salud-178284/",
          "nombre": {
            "es": "Promed Costa Rica (Cámara Costarricense de la Salud)",
            "en": "Promed Costa Rica (Costa Rican Chamber of Health)"
          },
          "descripcion": {
            "es": "Sitio oficial del evento: organizadores, programa, ponentes (Viceministro Allan Mora, Elliott Garita, Eva Cortés, ponentes internacionales) y mención del Connectathon HL7 FHIR R5 de resultados de laboratorio.",
            "en": "Official event site: organizers, program, speakers (Deputy Minister Allan Mora, Elliott Garita, Eva Cortés, international speakers) and mention of the HL7 FHIR R5 Laboratory Results Connectathon."
          }
        }
      ]
    },
    {
      "id": "convocatoria-fernandez-mayo-2026",
      "fecha": "2026-05-13",
      "etiqueta": {
        "es": "Coyuntura · mayo 2026",
        "en": "Current affairs · May 2026"
      },
      "titulo": {
        "es": "Convocatoria Fernández: 62 proyectos, ninguno sobre IA",
        "en": "Fernández agenda: 62 bills called, none on AI"
      },
      "texto": {
        "es": "El gobierno de Laura Fernández convocó 62 proyectos de ley para sesiones extraordinarias de la Asamblea Legislativa en mayo de 2026. Las prioridades declaradas: seguridad, energía, reforma fiscal y deuda pública. Los tres expedientes de regulación de IA activos (23.771, 23.919 y 24.484) no fueron incluidos. El expediente 23.919 tiene dictamen aprobado desde marzo de 2025 y está técnicamente listo para debate en plenario. Esta decisión mantiene el patrón del período anterior: el gobierno Chaves tampoco convocó los expedientes IA durante 2022-2026, y el Ministerio de Ciencia y Tecnología se opuso formalmente a los tres proyectos argumentando riesgo de obsolescencia regulatoria.",
        "en": "The Laura Fernández administration called 62 bills for extraordinary sessions of the Legislative Assembly in May 2026. Stated priorities: security, energy, fiscal reform and public debt. None of the three active AI regulation bills (23.771, 23.919 and 24.484) were included. Bill 23.919 has had an approved committee report since March 2025 and is technically ready for floor debate. This decision continues the previous administration's pattern: the Chaves government also did not call the AI bills during 2022-2026, and the Ministry of Science and Technology formally opposed all three projects, arguing risk of regulatory obsolescence."
      },
      "implicacion": {
        "es": "Las instituciones que ya operan sistemas de IA en producción (Hacienda, CCSS, Poder Judicial) continúan sin marco legal específico. La ausencia de convocatoria no impide el avance legislativo por iniciativa propia de la Asamblea, pero sí señala que la IA no es una prioridad del Ejecutivo en este período.",